{"analysis_coverage":{"reasons":[],"status":"COMPLETE"},"analysis_mode":"standard","evidence":[{"error_count":1,"error_rate_ratio":{"denominator":3,"numerator":1},"id":"metric-summary-overall","latency_ms":{"max":496,"p50":84,"p95":496,"p99":496},"sample_count":3,"scope":{"kind":"overall"},"throughput_rps":{"denominator":643,"numerator":3000},"type":"metric_summary"},{"error_count":0,"error_rate_ratio":{"denominator":1,"numerator":0},"id":"metric-summary-799fecd9fe4bde3c9e397fc2f19f2b6b661de9bc6226a10a31cb51d981f4fe88","latency_ms":{"max":496,"p50":496,"p95":496,"p99":496},"sample_count":1,"scope":{"group_path":[],"kind":"transaction","label":"GET /health","sample_kind":"JMETER_SAMPLER"},"throughput_rps":{"denominator":643,"numerator":1000},"type":"metric_summary"},{"error_count":1,"error_rate_ratio":{"denominator":1,"numerator":1},"id":"metric-summary-1a279a56388824a5efcad84637ea2328fcbb88eec82e7ef6473f55f50675dd79","latency_ms":{"max":62,"p50":62,"p95":62,"p99":62},"sample_count":1,"scope":{"group_path":[],"kind":"transaction","label":"GET /items, detail","sample_kind":"JMETER_SAMPLER"},"throughput_rps":{"denominator":643,"numerator":1000},"type":"metric_summary"},{"error_count":0,"error_rate_ratio":{"denominator":1,"numerator":0},"id":"metric-summary-5182b2ed14a229ddeeef0af56a39a08a05dfc75eb2e1e608d5d9c69b943f8e69","latency_ms":{"max":84,"p50":84,"p95":84,"p99":84},"sample_count":1,"scope":{"group_path":[],"kind":"transaction","label":"POST /orders","sample_kind":"JMETER_SAMPLER"},"throughput_rps":{"denominator":643,"numerator":1000},"type":"metric_summary"},{"id":"policy-check-3d8d2de3963d76479315da34661b01541658639e1a50853f486bdd27c744fe90","metric":"response_time_p95_ms","metric_evidence_id":"metric-summary-overall","min_samples":1,"observed":496,"operator":"lte","rule_id":"overall-p95","sample_count":3,"sample_floor":1,"sample_mode":"FULL","status":"FAIL","threshold":100,"type":"policy_check"}],"findings":[{"evidence_id":"policy-check-3d8d2de3963d76479315da34661b01541658639e1a50853f486bdd27c744fe90","id":"policy-failure-3d8d2de3963d76479315da34661b01541658639e1a50853f486bdd27c744fe90","rule_id":"overall-p95","type":"policy_failure"}],"policy_verdict":"FAIL","run_id":"jmeter_jtl_csv-6f9e658876e83eda9a3727dbb32612a2f54800ee34ea22641deeab6781f82601","run_validity":"VALID","schema_version":"analysis-result.v1"}