{"analysis_coverage":{"reasons":[],"status":"COMPLETE"},"analysis_mode":"standard","evidence":[{"error_count":1,"error_rate_ratio":{"denominator":3,"numerator":1},"id":"metric-summary-overall","latency_ms":{"max":26,"p50":1,"p95":26,"p99":26},"sample_count":3,"scope":{"kind":"overall"},"throughput_rps":{"denominator":86,"numerator":3000},"type":"metric_summary"},{"error_count":1,"error_rate_ratio":{"denominator":1,"numerator":1},"id":"metric-summary-8d80417950f2f6ee098483e6cb0c3b3e8f1ebba4250aa195ffe8b13a038782ea","latency_ms":{"max":28,"p50":28,"p95":28,"p99":28},"sample_count":1,"scope":{"group_path":[],"kind":"transaction","label":"Checkout scenario","sample_kind":"JMETER_CONTAINER"},"throughput_rps":{"denominator":86,"numerator":1000},"type":"metric_summary"},{"error_count":0,"error_rate_ratio":{"denominator":1,"numerator":0},"id":"metric-summary-8e72e2c51c903181cbbaedd6e7f0c28b5477d603886cdf73316472da04e7a3e4","latency_ms":{"max":28,"p50":28,"p95":28,"p99":28},"sample_count":1,"scope":{"group_path":["Checkout scenario"],"kind":"transaction","label":"HTTP checkout","sample_kind":"JMETER_CONTAINER"},"throughput_rps":{"denominator":86,"numerator":1000},"type":"metric_summary"},{"error_count":1,"error_rate_ratio":{"denominator":1,"numerator":1},"id":"metric-summary-b414ea6da57a8537598174f9f85476f85b4167b32645b4c036644220a60ab4b7","latency_ms":{"max":0,"p50":0,"p95":0,"p99":0},"sample_count":1,"scope":{"group_path":["Checkout scenario"],"kind":"transaction","label":"POST /order","sample_kind":"JMETER_SAMPLER"},"throughput_rps":{"denominator":86,"numerator":1000},"type":"metric_summary"},{"error_count":0,"error_rate_ratio":{"denominator":1,"numerator":0},"id":"metric-summary-a2e4f2ba0237cc0ee2152f66e6af814a5e1f73e8a6374ff1ea767c31e349841d","latency_ms":{"max":1,"p50":1,"p95":1,"p99":1},"sample_count":1,"scope":{"group_path":["Checkout scenario","HTTP checkout"],"kind":"transaction","label":"http://127.0.0.1:18081/final","sample_kind":"JMETER_SAMPLER"},"throughput_rps":{"denominator":86,"numerator":1000},"type":"metric_summary"},{"error_count":0,"error_rate_ratio":{"denominator":1,"numerator":0},"id":"metric-summary-71089af60a9a3239d7a48dcf303d30dd57680f35832c8113799a8b0769100607","latency_ms":{"max":26,"p50":26,"p95":26,"p99":26},"sample_count":1,"scope":{"group_path":["Checkout scenario","HTTP checkout"],"kind":"transaction","label":"http://127.0.0.1:18081/start","sample_kind":"JMETER_SAMPLER"},"throughput_rps":{"denominator":86,"numerator":1000},"type":"metric_summary"},{"id":"policy-check-3d8d2de3963d76479315da34661b01541658639e1a50853f486bdd27c744fe90","metric":"response_time_p95_ms","metric_evidence_id":"metric-summary-overall","min_samples":1,"observed":26,"operator":"lte","rule_id":"overall-p95","sample_count":3,"sample_floor":1,"sample_mode":"FULL","status":"PASS","threshold":100,"type":"policy_check"}],"findings":[],"policy_verdict":"PASS","run_id":"jmeter_jtl_xml-e01fcf204803ad94f66f5bd5e96c7750a26922abfdc929489b6a5fc44627d82e","run_validity":"VALID","schema_version":"analysis-result.v1"}