{"analysis_coverage":{"reasons":["INSUFFICIENT_OBSERVATIONS"],"status":"INCOMPLETE"},"analysis_mode":"standard","evidence":[{"error_count":1,"error_rate_ratio":{"denominator":2,"numerator":1},"id":"metric-summary-overall","latency_ms":{"max":40,"p50":25,"p95":40,"p99":40},"sample_count":2,"scope":{"kind":"overall"},"throughput_rps":{"denominator":1040,"numerator":2000},"type":"metric_summary"},{"error_count":0,"error_rate_ratio":{"denominator":1,"numerator":0},"id":"metric-summary-799fecd9fe4bde3c9e397fc2f19f2b6b661de9bc6226a10a31cb51d981f4fe88","latency_ms":{"max":25,"p50":25,"p95":25,"p99":25},"sample_count":1,"scope":{"group_path":[],"kind":"transaction","label":"GET /health","sample_kind":"JMETER_SAMPLER"},"throughput_rps":{"denominator":1040,"numerator":1000},"type":"metric_summary"},{"error_count":1,"error_rate_ratio":{"denominator":1,"numerator":1},"id":"metric-summary-12567634dc037cd0871b510a6af64b37e6d6a5755313b8b3f5298f9679ccb787","latency_ms":{"max":40,"p50":40,"p95":40,"p99":40},"sample_count":1,"scope":{"group_path":[],"kind":"transaction","label":"GET /items","sample_kind":"JMETER_SAMPLER"},"throughput_rps":{"denominator":1040,"numerator":1000},"type":"metric_summary"},{"clock_alignment":"not_verified_by_core","dropped_leading_cells":0,"dropped_leading_millis":0,"dropped_trailing_cells":0,"dropped_trailing_millis":0,"evaluation_from_epoch_ms":1767225600000,"evaluation_to_epoch_ms":1767225601000,"id":"resource-binding","mode":"explicit_windows","run_from_epoch_ms":1767225600000,"run_to_epoch_ms":1767225601040,"snapshot_from_epoch_ms":1767225600000,"snapshot_to_epoch_ms":1767225602000,"type":"resource_binding"},{"aggregation":"interval_mean","entity":"vm","expected_cells":1,"from_epoch_ms":1767225600000,"id":"resource-summary-a20bf4e6e48507391385970d2467a96b5d2e9fdfea687925c570a68fe8eb14ea","longest_gap_cells":0,"metric":"cpu_used","missing_cells":0,"observed_cells":1,"reasons":["INSUFFICIENT_OBSERVATIONS"],"role":"system","series_id":"cpu","statistics":{"iqr":"0","mad":"0","max":"0.1","mean":"0.1","median":"0.1","min":"0.1","q05":"0.1","q25":"0.1","q75":"0.1","q95":"0.1","sample_standard_deviation":null,"slope_per_second":null,"split_half_shift":null},"to_epoch_ms":1767225601000,"type":"resource_summary","unit":"ratio","window_id":"steady"},{"effect":"sla","id":"resource-policy-check-239daae455018f687238d663be7831142e5a0603b45fc402562d588e32a09a5f","operator":"gt","reason":null,"rule_id":"cpu-high","series_id":"cpu","status":"PASS","threshold":"0.8","type":"resource_policy_check","unit":"ratio","window_id":"steady"},{"id":"policy-check-window-bd94f1249463297b96ef6f77860c587888444c9d867ecc88b75d7227f3a4e867","metric":"response_time_p95_ms","min_samples":1,"observed":25,"operator":"lte","rule_id":"overall-p95","sample_count":1,"sample_floor":1,"sample_mode":"FULL","scope":{"kind":"overall"},"status":"PASS","threshold":100,"type":"policy_check","window_id":"steady"},{"business_verdict":"PASS","from_epoch_ms":1767225600000,"id":"window-policy-summary-57e1f047b30bdadc4b84b18061faf30a0dd3d58336cbc91c8dd28a6b6f4927e9","min_samples":1,"resource_verdict":"PASS","sample_count":1,"to_epoch_ms":1767225601000,"type":"window_policy_summary","verdict":"PASS","window_id":"steady"}],"findings":[],"policy_verdict":"PASS","run_id":"jmeter_jtl_csv-150557329781e91d81c3496b76c4c69200be44b2fcd59fddac5f046b699fa19b","run_validity":"VALID","schema_version":"analysis-result.v1"}